{"acceptance":["Every finding recorded in .anoikis/runlog-stats/findings.json is resolved or explicitly refuted with evidence.","The reviewed nodes' own acceptance criteria still hold."],"deliverable_kind":"code","id":"fix-054e9eeb-0","inputs":{"spec_refs":[".anoikis/runlog-stats/findings.json"]},"intent":"Resolve every finding the review of cli-core raised, as recorded in .anoikis/runlog-stats/findings.json.","result":{"run_result_refs":["results/fix-054e9eeb-0.json"],"usage":{"cache_creation_tokens":420870,"cache_read_tokens":3475715,"cost_usd":2.857395,"input_tokens":58,"known":true,"output_tokens":15749}},"schema_version":"1.0.0","stages":[{"context_window":"200k","effort":"high","model":"claude-sonnet-5","role":"builder","stage":"build"},{"context_window":"200k","effort":"medium","model":"claude-sonnet-5","role":"tester","stage":"test"}]}
