{"acceptance":["Every finding recorded in .anoikis/runlog-stats/findings.json is resolved or explicitly refuted with evidence.","The reviewed nodes' own acceptance criteria still hold."],"deliverable_kind":"docs","id":"fix-f838e262-0","inputs":{"spec_refs":[".anoikis/runlog-stats/findings.json"]},"intent":"Resolve every finding the review of usage-docs raised, as recorded in .anoikis/runlog-stats/findings.json.","result":{"artifact_refs":["docs/usage.md"],"run_result_refs":["results/fix-f838e262-0.json"],"usage":{"cache_creation_tokens":278094,"cache_read_tokens":4698333,"cost_usd":2.577712,"input_tokens":74,"known":true,"output_tokens":8342}},"schema_version":"1.0.0","stages":[{"context_window":"200k","effort":"medium","model":"claude-sonnet-5","role":"writer","stage":"build"}]}
