{"acceptance":["A usage doc exists at `docs/usage.md` carrying a synopsis, one worked example, and the unpriced-vs-total rule stated explicitly.","The worked example is a real invocation of the built binary and its actual output, quoted byte-for-byte from a run rather than reconstructed, and the commands in the doc run as written against the built binary.","The doc states the cost rule: only events with `usage.known == true` and `cost_usd` present contribute to the total, and the three unpriced shapes (no `usage` object; `known == false`; `known == true` with `cost_usd` absent) are counted separately and never added into the total.","The doc shows the accounting line on that real example and explains which reported numbers sum to the line count — including that an event can be both counted in a node row and counted as unpriced, so the two are not additive (design risk 5).","The doc records the row sort order and the reserved label used for events with no `role`, matching what the built binary actually does rather than what design.md defaulted to.","README.md's \"per-stage/per-role\" wording is aligned with the terms the tool prints: the first grouping is `node_id`, and the run-log schema has no `stage` field. Whether the README's status line is also rewritten is this node's call (design open question 6).","Behaviour is unchanged: this node touches only README.md and docs/, never the Go sources, go.mod, or testdata/, and it adds no dependency.","Documents the tool as it is, including its non-goals where a reader would otherwise assume otherwise: one input per invocation, no per-`run_id` grouping, no JSON/CSV output, no token or timing figures."],"deliverable_kind":"docs","id":"usage-docs","inputs":{"spec_refs":["design.md#success-criteria","design.md#scope","nodes/cli-core.json"]},"intent":"Write the short usage doc for runlog-stats at docs/usage.md — synopsis, one worked example whose output is quoted from the built binary rather than imagined, and the unpriced-vs-total rule — and reconcile the README stub's wording with what the tool actually prints. Depends on cli-core because the output layout design.md leaves to the implementer (open question 2) becomes the contract this doc quotes: run the built binary and paste its real output. Documents behaviour only; changes none.","result":{"artifact_refs":["docs/usage.md","README.md"],"run_result_refs":["results/usage-docs.json"],"usage":{"cache_creation_tokens":289709,"cache_read_tokens":2886779,"cost_usd":2.108473,"input_tokens":46,"known":true,"output_tokens":10393}},"schema_version":"1.0.0","stages":[{"context_window":"200k","effort":"medium","model":"claude-sonnet-5","role":"writer","stage":"build"}]}
